question_id	curator_name	domain	question_style	skills_tested	question	internet_required	gpu_preferred	file_paths
spatial-sim-q1	BO	Spatial	Synthetic/Augmented Data	Coding, Reasoning, Visual Reasoning, Data Wrangling	You are given a set of single cell transcriptomic data and Visium spatial transcriptomic data (spatial.sim.tar.gz). The single cell counts matrix is found at spatial_q_sc_counts.csv, and accompanying cell type metadata is found at spatial_q_sc_metadata.csv. Spatial count data is found at spatial_q_matrix.mtx.gz, gene counts are found at spatial_q_features.tsv.gz, and are found at spot barcodes spatial_q_barcodes.tsv.gz. Finally scale factors are found at spatial_q_scalefactors_json.json, high and low resolution tissue images are found at spatial_q_tissue_hires_image.png and patial_q_tissue_hires_image.png respectively, and tissue positions are found at spatial_q_tissue_positions.csv. The spot-based data is comprised entirely of cell types found in the single cell data. Can you tell me what cell type or cell types are included in spot ID Spot_710-1? Please list these separated by commas in alphabetical order. Expected answer format: Endothelial,Macrophage.	True	False	spatial.sim.tar.gz
compute-nonoverlapping-exonic-length-q1	AL	Transcriptomics	Routine Analysis	API/Web Fetching, Coding	Compute the total non-overlapping exonic length in base pairs for the mouse gene Lepr using the GENCODE mouse release M31 GTF located at https://ftp.ebi.ac.uk/pub/databases/gencode/Gencode_mouse/release_M31/gencode.vM31.annotation.gtf.gz. Output a single non-negative integer.	True	False	
atac-doublet-q1	SN	Single-cell	Synthetic/Augmented Data	Reasoning, Bioinformatics Tools	"atac.doublet.q1.bed.gz contains a fragment file from a scATAC-seq sample (hg38). Barcodes with low read counts have been filtered out. Look for doublets. Return the coordinates of any one doublet, if any. Respond only with the label of the barcode in the format: ""AAATGGAACGTTAAAG-1"", or ""None""."	False	False	atac.doublet.q1.bed.gz
enriched-motif-identification-q1	LG	Epigenomics	Synthetic/Augmented Data	Bioinformatics Tools, Reasoning	Consider the DNA sequence provided as dna_with_secret_motif.fasta. Of these motifs, which is the most prevalent? FOXA1, GATA3, MAX, STAT1, OCT4, P53, NANOG, HNF4A, TBP, FOS, MYC, JUN, FOXO1, CTCF, TCF7, SOX2, E2F1, CREB1, GATA1, KLF3.	True	False	dna_with_secret_motif.fasta
find-deletion-q1	SN	Genomics	Synthetic/Augmented Data	Bioinformatics Tools, Reasoning, Coding	You are given shallow paired-end whole genome sequencing FASTQ files (find.deletion.r1.fq.gz, find.deletion.r2.fq.gz) simulated from a chromosome of the human genome hg38 which contains a large deletion. Your task is to identify the approximate coordinates of this deletion relative to the reference genome. Report the chromosome, the start coordinate, and the end coordinate of the deletion, with both coordinates rounded to the nearest 100,000 bases. Format your answer as chr:start-end. For example: chr1:10000000-10300000.	True	False	find.deletion.r1.fq.gz, find.deletion.r2.fq.gz
three-way-barnyard-q1	SN	Single-cell	Synthetic/Augmented Data	Bioinformatics Tools, Coding	"Given paired-end 10x scRNA-seq FASTQs (three.way.barnyard.q1.R1.fq.gz, three.way.barnyard.q1.R2.fq.gz) from a 3-species barnyard (human, mouse, pig)—R1 = 28-bp cell barcode+UMI, R2 = 91-bp cDNA—assume all barcodes are valid single cells (no empty droplets or doublets; no further barcode filtering required) and report the mixture as percentages rounded to the nearest 10%, semicolon-separated, summing to 100, for human, mouse, and pig, respectively. Example output: ""50;20;30""."	True	False	three.way.barnyard.q1.R1.fq.gz, three.way.barnyard.q1.R2.fq.gz
subtype-inflammation-q1	SN	Single-cell	Synthetic/Augmented Data	Bioinformatics Tools, Reasoning	subtype.inflammation.q1.1.mtx.gz and subtype.inflammation.q1.2.mtx.gz contain raw scRNA counts matrices from retinal samples from two eyes of an individual (one per file, each column is a unique barcode that passes QC). subtype.inflammation.q1.genes.txt.gz is the list of common genes. One of the cell types is inflammed in one eye compared to the other. What is this cell type? Return only the name of the inflammed cell type from this list: astrocyte, microglial cell, RPE cell, cone cell, rod cell, horizontal cell, bipolar cell, RGC, T cells, macrophage, Schwann cell, Pericyte, B cell, fibroblast, muller glia cell, endothelial cell.	True	False	subtype.inflammation.q1.1.mtx.gz, subtype.inflammation.q1.2.mtx.gz, subtype.inflammation.q1.genes.txt.gz
read-proportions-q1	SN	Genomics	Synthetic/Augmented Data	Bioinformatics Tools, Reasoning, Coding	read.proportions.q1.fa contains a synthetic genome with four chromosomes. read.proportions.q1.fq.gz contains 40,000 single-end 36 bp reads drawn from this genome. A read is generated by first picking a chromosome with probability pi =(pi_1, ..., pi_4), then sampling a position uniformly along that chromosome, with some small error rate. Estimate pi and report four integers (percentages) in FASTA contig order (chr1–chr4), each rounded to the nearest 5; if needed, adjust the last value so the total is 100. Expected output format: 15,25,25,35.	False	False	read.proportions.q1.fa, read.proportions.q1.fq.gz
sample-swap-atac-q2	SN	Single-cell	Metadata Recovery	Coding, Reasoning, Data Wrangling	"I have a single-cell ATAC-seq cluster counts pseudobulks lying around from human retinal-associated tissue (sample.swap.atac.q2.tsv.gz). I'm not sure, but I suspect there is a sample swap. Can you check if that is the case? If there isn't, respond ""None"". Else respond with the names of the two cell types that have been swapped in case-sensitive lexicographic order, e.g. ""AIIamacrine,Rod""."	True	False	sample.swap.atac.q2.tsv.gz
exogenous-mix-reads-q1	SN	Transcriptomics	Synthetic/Augmented Data	Bioinformatics Tools, Reasoning	I have FASTQ data from a perturbation experiment involving KLF4 exogenous overexpression using a Sendai virus. I want to estimate the fraction of exogenous-origin reads in exogenous.mix.reads.q1.mix.fq, given exogenous.mix.reads.q1.exo.fq (early timepoint, assumed purely exogenous) and exogenous.mix.reads.q1.endo.fq (later timepoint, predominantly endogenous). All files contain reads mapping to KLF4. I don't have details on the Sendai construct. If possible, estimate the percent of exogenous reads in exogenous.mix.reads.q1.mix.fq (by read count) to the nearest 10 and return only the integer (e.g. 50); if not possible, return NA.	True	False	exogenous.mix.reads.q1.mix.fq, exogenous.mix.reads.q1.endo.fq, exogenous.mix.reads.q1.exo.fq
perturb-seq-align-q1	SN	Single-cell	Metadata Recovery	Reasoning, Coding, Data Wrangling	"perturb.seq.align.q1.ref.h5ad contains a scRNA-seq matrix from a small scale Perturb-seq experiment in a cell type. perturb.seq.align.q1.query.h5ad contains a scRNA-seq matrix from a Perturb-seq experiment using the same guides in a different cell type. However, the targets of the guides are missing. Can you find the guides corresponding to the following target genes: PABPC1, NUDT21, LEO1. Return the answer as a comma separate list in the format: ""guide1,guide2,guide3""."	False	False	perturb.seq.align.q1.ref.h5ad, perturb.seq.align.q1.query.h5ad
gwas-ancestry-q1	JR	Population Genetics	Metadata Recovery	API/Web Fetching, Coding, Reasoning, Bioinformatics Tools, Data Wrangling	Identify the ancestry group which was used to compute these summary statistics in the file gwas.ancestry.q1.tsv.gz. Your answer should be one of the following population codes: AFR (African), ASJ (Ashkenazi Jew), EAS (East Asian), EUR (European),  HIS (Hispanic), MID (Middle Eastern), OCE (Oceania), SAS (South Asian). Respond with the 3 letter code only.	True	False	gwas.ancestry.q1.tsv.gz
gene-info-grab-q1	LG	Genomics	Retrieval	API/Web Fetching	"Consider the gene Hand1. Answer each question with the exact format specified. 1. What is its Ensembl gene ID? (format: ENSMUSGXXXXXXXXXXX, no version suffix) 2. How many amino acids does the canonical protein isoform encode? (integer) 3. Does this gene have more than 5 or fewer than 5 introns? (answer: ""more"" or ""fewer"") 4. What is the Ensembl gene ID of the nearest protein-coding gene upstream of Hand1? (format: ENSMUSGXXXXXXXXXXX, no version suffix) Respond with semi-colon separate values, no spaces, e.g. ""ENSMUSGXXXXXXXXXXX;23;more;ENSMUSGXXXXXXXXXXX"""	True	False	
genome-coords-q1	LG	Epigenomics	Synthetic/Augmented Data	Coding, Reasoning, Data Wrangling	You are given a dataset (single_cell_dynamics_question.csv) of time-resolved single-cell measurements from 600 cells, each tracked over 250 consecutive time points. Each row corresponds to one cell at one time point and includes: enhancer coordinates: enh_x, enh_y, enh_z (nm), promoter coordinates: prom_x, prom_y, prom_z (nm), transcription - whether nascent transcription was detected at that time point (0/1). Define the enhancer-promoter distance as the 3D Euclidean distance. Define a proximity event (“contact”) deterministically as the distance <= 260nm. Based only on the quantities you computed above, select the single most defensible conclusion. Choose exactly one. A. Enhancer–promoter proximity and transcription are independent processes with no functional relationship. B. Transcriptional activity promotes enhancer–promoter proximity. C. Enhancer–promoter proximity promotes transcriptional activity. D. Contact and transcription share a feedback loop. E. An alternate explanation not covered here. Respond with a single letter (A-E).	False	False	single_cell_dynamics_question.csv
mystery-peak-set-q1	SN	Epigenomics	Metadata Recovery	API/Web Fetching, Reasoning, Coding	The file mystery.peak.set.q1.bed.gz contains genomic intervals for six distinct peak sets (S1–S6), all mapped to the hg38 reference genome. Each peak set represents accessible chromatin regions identified under different experimental conditions. One of these peak sets corresponds to a chromatin accessibility pattern that is strongly depleted in large public collections of unperturbed human samples, including both primary tissues and established cell lines. Identify which peak set (S1–S6) shows this depletion and report its name.	True	False	mystery.peak.set.q1.bed.gz
phase-chain-q1	SN	Population Genetics	Synthetic/Augmented Data	Bioinformatics Tools, Coding, Reasoning	Files phase.chain.q1.R1.fq.gz and phase.chain.q1.R2.fq.gz contain exactly 1000 read pairs (2x150) sampled 50:50 from 2 synthetic haplotypes covering a 1.5kb region of hg38. Discover all biallelic SNPs and 1-bp indels in the interval, and phase by read-backed evidence only. Return the haplotypes in genomic order in the form A-G-T-I|G-A-C-C for the 2 haploytpes, using I for insertion and D for deletion. Use alphabetical ordering to decide which haplotype comes first.	False	False	phase.chain.q1.R1.fq.gz, phase.chain.q1.R2.fq.gz
enformer-basic-q1	SN	Machine Learning	Tooling	Tooling, Coding, API/Web Fetching, Reasoning, ML Frameworks	What is the exact count of the number of parameters in the Enformer model (https://doi.org/10.1038/s41592-021-01252-x). Specifically, report the number of trainable parameters including both the human and mouse heads. Format the number without commas.	True	False	
bedtools-ops-q1	SN	Epigenomics	Routine Analysis	Bioinformatics Tools, Data Wrangling	In the given ENCODE narrowpeak bed file ENCFF333TAT.bed.gz, convert each interval into a 500bp interval centered at the peak summit. Merge all intervals, and then exclude any that overlaps with the provided blacklist file ENCFF356LFX.bed.gz. Return the total number of bases in the final file, no commas.	False	False	ENCFF356LFX.bed.gz, ENCFF333TAT.bed.gz
orf-annot-q1	CD	Genomics	Retrieval	API/Web Fetching, Reasoning, Coding	You are given a fasta file containing a human mRNA sequence. Find the main CDS of the sequence, return the start position of the CDS (in a 0-based coordinate system, starting from the first base of the given sequence) and the length of the translated protein in the format 4;2.	True	False	orf.annot.q1.fa
reverse-search-gwas-q2	JR	Population Genetics	Metadata Recovery	API/Web Fetching, Reasoning, Data Wrangling	Identify the PubMed ID of the study from which the summary stats in reverse.search.gwas.q2.gz are derived. Print only the PMID, e.g. 31510655.	True	False	reverse.search.gwas.q2.gz
disease-samples-q1	SN	Transcriptomics	Metadata Recovery	Reasoning, Coding	The file disease.samples.q1.tsv contains bulk RNA-seq TPM data for 9 individuals. Metadata is missing, but the samples are known to be a mix of healthy and diseased subjects. Identify the diseased samples and return their IDs as a sorted, comma-separated string (e.g., Sample_2,Sample_8,Sample_9).	True	False	disease.samples.q1.tsv
contaminated-rna-q1	SN	Transcriptomics	Synthetic/Augmented Data	Bioinformatics Tools, Reasoning	"You are given a single end RNA-seq fastq file (contaminated.rna.q1.fq.gz). This file contains mostly human reads and a small fraction of contaminant reads. Identify the contaminant species present. Report the answer as the exact scientific name of the species in all lowercase letters with a single space separating genus and species, for example ""mus musculus""."	True	False	contaminated.rna.q1.fq.gz
variant-coordinate-lookup-q1	LG; SN	Genomics	Retrieval	API/Web Fetching	Retrieve the single base genomic position for the following variant identifiers: rs200533370, rs241311, NM_006492.3:c.595-2A>T, CA548798891, VCV000587372.6, OMIM 616787.0001 on the GRCh38 reference assembly. Report in semi-colon separated chr#:position format (1-based, inclusive), no spaces (e.g. chr1:2;chr2:34).	True	False	
histone-chip-q1	SN	Epigenomics	Metadata Recovery	Reasoning, Bioinformatics Tools	I have a histone ChIP-seq ENCODE-style filtered tagAlign file (histone.chip.q1.signal.tagalign.gz) along with its control (histone.chip.q1.control.tagalign.gz), both hg38. I lost the metadata. Can you figure out the histone mark? Output exactly one label from this set: H3K4me3, H3K27ac, H3K4me1, H3K36me3, H3K27me3, H3K9me3.	True	False	histone.chip.q1.signal.tagalign.gz, histone.chip.q1.control.tagalign.gz
cell-proportions-q1	BO	Single-cell	Synthetic/Augmented Data	Reasoning, Bioinformatics Tools	I have a counts matrix of single cell transcriptomic data, cell.proportions.q1.mtx.gz. The data contains measurements from 5350 cells, each with 1000 measured genes. That data was generated by measuring data from a co-culture of a few unique cell types. Can you tell me the proportions of those cells in descending order to the nearest 5 percent? Drop any cells with questionable QC. Expected output: 35;35;20;10 if there are 4 cell types.	True	False	cell.proportions.q1.mtx.gz
three-way-barnyard-q2	SN	Single-cell	Synthetic/Augmented Data	Bioinformatics Tools, Coding, Reasoning	Given paired-end 10x scRNA-seq FASTQs (three.way.barnyard.q2.R1.fq.gz, three.way.barnyard.q2.R2.fq.gz) from a 3-species barnyard (human, mouse, pig)—R1=28-bp cell barcode+UMI, R2≈91-bp cDNA. The barcodes are pre-thresholded for minimum read depth. Report the percentages among confidently assigned single-cell barcodes for human, mouse, pig (rounded to the nearest 10%, comma-separated, summing to 100) and also assign a tissue of origin for human, mouse, pig, respectively, chosen from: liver, heart, testis, kidney, bone_marrow, spleen, cortex, retina, lung, skin. Expected output format: 40;40;20;kidney;heart;heart.	True	False	three.way.barnyard.q2.R1.fq.gz, three.way.barnyard.q2.R2.fq.gz
chip-pioneer-q1	SN	Epigenomics	Metadata Recovery	API/Web Fetching, Reasoning, Bioinformatics Tools	chip.pioneer.q1.tar contains fragment bed files obtained by aligning paired-end reads from multiple ChIP-seq experiments and their input controls using the Chromap aligner (v0.2.6, --preset chip, hg38). 6 TFs (TF1-TF6) were each separately overexpressed in BJ fibroblasts for 48 hours at comparable protein levels, and ChIP-seq was then performed. Obtain the BJ fibroblasts DNase-seq data corresponding to ENCODE accession ENCSR000EME. Using these, determine which TF showcases the most pioneering ability- which can be assumed to be reflected in the ChIP-seq signal at 48 hours. Respond with one of TF1, TF2, TF3, TF4, TF5, TF6.	True	False	chip.pioneer.q1.tar
deleterious-mutation-q2	SN	Genomics	Synthetic/Augmented Data	Bioinformatics Tools, Data Wrangling	In deleterious.mutation.q2.R1.fq.gz (exome 1×150 bp, reads from human 50Mb chunk of chr9 only), there is one gene that harbors a high-confidence nonsense SNV consistent with somatic mosaicism. The gene is highly LoF-intolerant. Report the HGNC gene symbol (uppercase) for the affected gene, and the approximate alternate allele frequency, rounded to the nearest 10%. Expected output format: POU5F1,10	True	False	deleterious.mutation.q2.R1.fq.gz
bam-ops-q1	SN	Genomics	Routine Analysis	Bioinformatics Tools	For the given BAM file mt.sorted.bam, how many reads pass quality threshold of 30 and are properly paired?	False	False	mt.sorted.bam
perturb-seq-effect-q1	BO	Single-cell	Synthetic/Augmented Data	Coding, Reasoning	You are given the cellranger output of a CRISPR perturb-seq experiment in perturb.seq.effect.q1.tar.gz where cell features are at filtered_feature_bc_matrix/features.tsv.gz, counts are at filtered_feature_bc_matrix/matrix.mtx.gz, barcodes are at filtered_feature_bc_matrix/barcodes.tsv.gz, guide assignment per cell is at perturb_protospacer_calls_per_cell.csv, and guide reference at feature_reference.csv. I am interested in finding guides which robustly knockdown the interferon gamma pathway. We need to decide which target gene from this screen to explore in a follow up screen - which gene target should be selected? Respond with a single gene target name (i.e. CCL6).	True	False	perturb.seq.effect.q1.tar.gz
exogenous-mix-reads-q2	SN	Transcriptomics	Synthetic/Augmented Data	Bioinformatics Tools, Reasoning	I have FASTQ data from a perturbation experiment involving KLF4 exogenous overexpression using a Sendai virus. I want to estimate the fraction of exogenous-origin reads in exogenous.mix.reads.q2.mix.fq, given exogenous.mix.reads.q2.exo.fq (early timepoint, assumed purely exogenous) and exogenous.mix.reads.q2.endo.fq (later timepoint, predominantly endogenous). All files contain reads mapping to KLF4. I don't have details on the Sendai construct.  If possible, estimate the percent of exogenous reads in exogenous.mix.reads.q2.mix.fq (by read count) to the nearest 10 and return only the integer (e.g. 50); if not possible, return NA.	True	False	exogenous.mix.reads.q2.mix.fq, exogenous.mix.reads.q2.endo.fq, exogenous.mix.reads.q2.exo.fq
align-one-sequence-to-reference-q1	SN	Genomics	Routine Analysis	Bioinformatics Tools	Where does CACACACAGGAGAT align to in the given GCF_000001215.4_Release_6_plus_ISO1_MT_genomic.fna? Report as 0-based coordinates in contig:start-end format (no commas).	False	False	GCF_000001215.4_Release_6_plus_ISO1_MT_genomic.fna
promoter-sequence-retrieval-q1	GE	Genomics	Routine Analysis	API/Web Fetching, Coding	Using the Ensembl GRCz11 genome assembly and Ensembl gene annotation, what is the DNA sequence of the promoter region of the zebrafish gene shha? Define the promoter as the region spanning positions −500 to +100 relative to the transcription start site (TSS) of the canonical transcript, where the TSS is position 0, negative positions are upstream, and positive positions are downstream, yielding a 601 bp sequence. Return the sequence in 5′ to 3′ orientation on the sense strand (reverse complement the genomic sequence if the gene is on the − strand).	True	False	
bedtools-chromhmm-q1	SN	Epigenomics	Routine Analysis	Bioinformatics Tools	"We wish to find the chromatin states overlapping the peaks in the given ENCODE narrowpeak bed file ENCFF333TAT.bed.gz. We have a ChromHMM annotation bed file E055_15_coreMarks_dense.bed.gz. What percentage of all bases in the peaks overlap with the 14_ReprPCWk annotation? Ignore bases in the peak file that don't have any corresponding annotation in the annotation file. Round to the nearest integer. Output format: ""42""."	False	False	ENCFF333TAT.bed.gz, E055_15_coreMarks_dense.bed.gz
lung-cancer-sc-q1	BO	Single-cell	Routine Analysis	Coding, Reasoning, Data Wrangling	You are given a single cell transcriptomic counts data generated from primary human tumor samples from patients with lung cancer (lung.cancer.sc.h5ad). This file has been cleaned for doublets and low quality cells already. Each sample is from a patient with lung adenocarcinoma (LUAD) or lung squamous cell carcinoma (LUSC). Out of samples Patient_005, Patient_006, Patient_007, Patient_018, and Patient_040, identify the LUSC sample with the highest proportion of dendritic cells out of all cells in that sample? Secondly, what percentage, to the nearest 20 percent, of all non-immune cells across all samples are malignant basal cells from LUSC patients? Expected answer format: Patient_006;20.	True	False	lung.cancer.sc.h5ad
tissue-fibroblast-q1	BO	Single-cell	Routine Analysis	Reasoning, Coding	"I have a counts matrix of transcriptomic reads from a murine multi-tissue fibroblast atlas, tissue.fibroblast.q1.rds. I want to know what tissue the fibroblast corresponding to barcode Cell_11249_MCI is from, and what tissue the fibroblast corresponding to the barcode Cell_10369_WXV is. Please provide an answer in a string format with each answer separated by a comma, and select each answer from ""Lymph node"", ""Pancreas"", ""Muscle"", ""Tendon"", ""Mesentery"", ""Omentum"" , 'Adipose"", ""Artery"", ""Bone"", ""Heart"", ""Intestine"", ""Skin"", ""Lung"", ""Liver"", or ""Spleen"". Expected output format example: Pancreas,Omentum. "	True	False	tissue.fibroblast.q1.rds
characterize-response-q1	SN	Transcriptomics	Metadata Recovery	API/Web Fetching, Reasoning	characterize.response.q1.txt contains an ordered list of differentially regulated genes in one direction (decreasing abs log-fold change, all sharing the same sign) in a specific immune cell type in response to a specific condition. Which condition, cell type pair from the following options most specifically describes this gene set. Conditions: a. stimulation by lipopolysaccharide (LPS), b. exhaustion, c. stimulation by cytokine LIF, d. stimulation by cytokine IL-39, e. COVID-19, f. sepsis, g. Med12 knockout, h. systemic lupus erythematosus, i. treatment with BMS-34554, j. treatment with aldesleukin, k. aging, l. rheumatoid arthritis. Cell types: i. monocytes, ii. CD8 T cells, iii. CD4 T cells, iv. B cells, v. dendritic cells, vi. NK cells, vii. Neutrophils. Respond in the format d;ii.	True	False	characterize.response.q1.txt
geo-lookup-read-matrix-market-q1	SN	Single-cell	Retrieval	API/Web Fetching, Data Wrangling	From the supplementary data of the GEO accession GSE242423, for the D2 scRNA-seq matrix, retrieve the counts for SOX2 for barcode AAACCCAAGTCTTCGA-1.	True	False	
annotate-variant-gene-impact-q1	GE	Genomics	Retrieval	API/Web Fetching	What is the clinical significance reported in the ClinVar database for the SPI1 variant represented by the HGVS notation NM_003120.3(SPI1):c.143-2A>C? Respond with only the correct cateogry. Answer in all lowercase.	True	False	
vcf-infer-build-q1	SN	Population Genetics	Metadata Recovery	API/Web Fetching, Reasoning, Bioinformatics Tools	You are given vcf.infer.build.q1.vcf.gz, a bgzipped VCF containing biallelic SNPs on chromosome 20 for one sample. The VCF has no rsIDs and does not specify a reference build in the header. Determine which reference genome build the VCF coordinates and REF alleles correspond to. Respond with exactly one of: hg18, hg19, hg38, T2T-CHM13.	True	False	vcf.infer.build.q1.vcf.gz
gene-pair-ordering-fraction-q1	AL	Single-cell	Routine Analysis	Coding, Data Wrangling	"From the dataset at 10x_pbmc68k_reduced.h5ad, consider only CD19+ B cells with percent_mito less than 0.04. Among these, compute the number of cells where expression of gene SRM exceeds that of gene MRPS21 by more than 1.0 (n_srm_higher), the number of cells where expression of gene MRPS21 exceeds that of gene SRM by more than 1.0 (n_mrps21_higher), and the number of cells where the difference in expression of the two genes is between 1 and -1 (inclusive) (n_within_range). Round all fractions to two decimal places. Return these numbers as a semicolon-separated string in the format n_srm_higher,n_mrps21_higher,n_within_range. An example of a correctly formatted string is: ""50;30;20""."	False	False	10x_pbmc68k_reduced.h5ad
1000G-retrieve-genotype-q2	SN	Population Genetics	Retrieval	API/Web Fetching, Bioinformatics Tools, Data Wrangling	"I would like to make a file with genotypes at specific loci for all individuals from the 1000G data with 3202 individuals (20201028_3202_raw_GT_with_annot). The positions should be common SNPs- snp151Common from UCSC, hg38. Select SNPs in which the observed allele column consists of exactly two distinct bases, where both alleles are strictly one of A, C, G, or T (i.e. not multi-allelic or indel). Further filter them to be within chr1 and within the 1000 genome-wide strongest peaks of the ENCODE peak file with accession ENCFF717TCQ (based on the qValue column). Create an uncompressed tsv with columns CHROM, POS, REF, ALT, and then the 3202 identifiers in lexicographic order (include header). In this tsv, the REF and ALT should come from the 1000G VCF. Keep those where both REF and ALT in 1000G are both exactly one of A,C,G,T. Convert any phased calls to unphased. Then, in the genotype cells, include only one of ""0/0"", ""0/1"", ""1/1"" or ""./."", reserving ""./."" for any that were not exactly one of the first 3. The SNPs should be sorted by coordinate. Report the total number of lines in this file along with the md5sum of this file, in the format ""201;md5sum""."	True	False	
