question_id	curator_name	domain	question_style	skills_tested	question	internet_required	gpu_preferred	file_paths
odd-one-out-q1	SN	Epigenomics	Metadata Recovery	Reasoning, Coding	odd.one.out.q1.tar.gz contains 10 ENCODE-style tagAlign files (hg38). Each file is a different experiment performed in a unique human cell line. 9 experiments were generated using the same assay, however 1 was generated using a different assay. What is index (1-10) of this outlier?	False	False	odd.one.out.q1.tar.gz
gene-expression-query-q1	GE	Transcriptomics	Retrieval	API/Web Fetching, Data Wrangling	Retrieve the median expression level for APOE from the 'Brain_Cortex' samples in the GTEx v8 reference dataset. The value should be in Transcripts Per Million as an integer.	True	False	
afgr-1000g-intersect-atac-q1	SN	Population Genetics	Retrieval	API/Web Fetching, Data Wrangling, Bioinformatics Tools	From the 1000G Phase 3 (3202 individuals), find all individuals that also have ATAC-seq filtered BAMs in the African Functional Genomics Resource (AFGR). Using only publicly available data, collect the md5sums of the filtered BAMs for these individuals (GRCh38 aligned), write the md5sums (one per line) to a text file sorted alphabetically. Return the count of samples and the file’s md5sum as a single comma-separated line, e.g., 42,md5hash.	True	False	
borzoi-basic-q1	SN	Machine Learning	Tooling	Tooling, Coding, API/Web Fetching, Reasoning, ML Frameworks	What is the exact count of the number of parameters in any one of the replicates of the Borzoi model (https://doi.org/10.1038/s41588-024-02053-6). Specifically, report the number of trainable parameters including both the human and mouse heads. Format the number without commas.	True	False	
annotate-variant-gene-impact-q2	GE	Genomics	Retrieval	API/Web Fetching	Using the Ensembl VEP API, determine the consequence for the following variant rs2136714166. Respond with a single word.	True	False	
gene-fusion-q1	SN	Transcriptomics	Synthetic/Augmented Data	Bioinformatics Tools, Reasoning, Coding	You are given paired-end RNA sequencing FASTQ files (gene.fusion.q1.R1.fq.gz, gene.fusion.q1.R2.fq.gz) from human. The data contains a synthetic gene fusion event. Your task is to identify the fusion genes. Report the answer as the names of the two genes joined by a hyphen, with the 5′ partner first and the 3′ partner second, written in all uppercase letters, HGNC symbols. For example: TCF21-COL1A1	True	False	gene.fusion.q1.R1.fq.gz, gene.fusion.q1.R2.fq.gz
compute-gccontent-promoter-q1	AL	Genomics	Routine Analysis	API/Web Fetching, Coding	Compute the GC content of the promoter window for the human transcript ENST00000269305 on assembly GRCh38. Use Ensembl release 115. Define the promoter interval as [TSS - upstream_bp, TSS + downstream_bp - 1] on the transcript’s strand, with upstream_bp=500 and downstream_bp=100. Report the results as a semicolon separated string in the format: chromosome,start,end,strand,promoter_length,gc_count,gc_fraction where chromosome, start, end and strand are the coordinates of the resolved promoter region, promoter_length is the length of the promoter, gc_count is the number of G or C bases in the promoter, and gc_fraction is the fraction of G/C bases in the promoter, rounded to two decimal places. All genome coordinates should be 1-based and closed. An example of a correctly formatted string is: 3;101;200;+;12;100;0.12	True	False	
vcf-infer-ancestry-q1	SN	Population Genetics	Metadata Recovery	Reasoning, API/Web Fetching, Bioinformatics Tools	You are given vcf.infer.ancestry.q1.vcf.gz, a bgzipped VCF containing variants on chromosome 1 for four unrelated individuals: Sample1, Sample2, Sample3, Sample4. Infer each individual’s ancestry as one of: AFR (African), ASJ (Ashkenazi Jew), EUR (European), EAS (East Asian), MID (Middle Eastern), SAS (South Asian), OCE (Oceania). Output 4 labels in Sample1→Sample4 order, comma-separated with no spaces (e.g., AFR,EUR,SAS,OCE).	True	False	vcf.infer.ancestry.q1.vcf.gz
find-amplification-q1	SN	Genomics	Synthetic/Augmented Data	Bioinformatics Tools, Reasoning, Coding	You are given shallow paired-end whole-genome sequencing FASTQ files (find.amplification.R1.fq.gz, find.amplification.R2.fq.gz) simulated from a chromosome of the human genome (hg38) that contains a regional copy-number gain. Identify the approximate coordinates of the amplified region relative to the reference genome and the amplification factor, defined as the mean read-depth in the amplified region divided by the mean read-depth in flanking non-amplified regions. Report the chromosome, the start coordinate, and the end coordinate rounded to the nearest 100,000 bases, followed by a single comma and the amplification factor rounded to nearest multiple of 0.5. Format your answer as chr:start-end factor. For example: chr21:23000000-26000000,2.0	True	False	find.amplification.q1.R1.fq.gz, find.amplification.q1.R2.fq.gz
sample-swap-atac-q1	SN	Single-cell	Metadata Recovery	Coding, Reasoning, Data Wrangling	"I have bulk ATAC-seq counts lying around from axolotl organs (sample.swap.atac.q1.tsv.gz). Since the genome is large, I broke down standard AmexG_v6.0-DD chromosomes into smaller chunks (sample.swap.atac.q1.chrom.sizes). I'm not sure, but I suspect there is a sample swap. Can you check if that is the case? If there isn't, respond ""None"". Else respond with the names of the two cell types that have been swapped in case-sensitive lexicographic order, e.g. ""Brain,GallBladder""."	True	False	sample.swap.atac.q1.tsv.gz, sample.swap.atac.q1.chrom.sizes
variant-status-q1	SN	Transcriptomics	Routine Analysis	Reasoning, Coding, API/Web Fetching	A collaborator sent me variant.status.q1.bam corresponding to a single-end RNA-seq experiment from an individual mapped to hg38. What is the likely variant status at position chrX:154,398,500 (1-based) for this individual? Respond in the format x/y, where x and y are one of A,C,G,T and x<y lexicographically, or x=y if homozygous.	True	False	variant.status.q1.bam
