question_id	curator_name	domain	question_style	skills_tested	question	internet_required	gpu_preferred	file_paths
ensembl-grab-q1	LG	Genomics	Retrieval	API/Web Fetching	Convert all of the following to Ensembl gene IDs. Provide the ID without the Ensembl version (e.g., ENSGXXXXXXXXXXXX not ENSGXXXXXXXXXXXX.XX). Respond with semi-colon separated values, no spaces. Inputs: 1. NM_001276266.2 2. TERB2 3. ENST00000267814 4. chr15:45167214-45187966 (hg38) 5. GeneID:9153 6. NP_922946.1 7. MIM:617658 8. BEN domain containing 5, transcript variant 6.	True	False	
bam-infer-read-length-q1	SN	Genomics	Metadata Recovery	Reasoning, Bioinformatics Tools	For the given BAM file mt.sorted.bam, infer if it's paired or single ended reads and the read length. Expected output format: 1x57	False	False	mt.sorted.bam
differential-composition-q1	SN	Single-cell	Synthetic/Augmented Data	Bioinformatics Tools, Reasoning	differential.composition.q1.1.mtx.gz and differential.composition.q1.2.mtx.gz contain raw scRNA counts matrices derived from retinal samples of two individuals (one per file, each column is a unique barcode that passes QC). differential.composition.q1.genes.txt.gz is the list of common genes. One of the cell types is severely depleted in one of the two individuals. What is this cell type? Return only the name of the depleted cell type from this list: astrocyte, microglial cell, RPE cell, cone cell, rod cell, horizontal cell, bipolar cell, RGC, T cells, macrophage, Schwann cell, Pericyte, B cell, fibroblast, endothelial cell, muller glia cell.	True	False	differential.composition.q1.1.mtx.gz, differential.composition.q1.2.mtx.gz, differential.composition.q1.genes.txt.gz
genomic-state-q1	LG	Epigenomics	Routine Analysis	API/Web Fetching, Reasoning	Consider chr11:124,738,681-124,738,772 (hg38). What is the likely purpose of this region? Choose only one. A. Active enhancer, Liver B. Active enhancer, Brain frontal lobe C. Active enhancer, ESC D. Active transcription, ubiquitous E. TSS poised or flanking, ubiquitous F. Polycomb repression, ubiquitous. Respond with a single letter.	True	False	
cryptic-exon-q1	SN	Transcriptomics	Synthetic/Augmented Data	Coding, Reasoning, Bioinformatics Tools	I have a bulk human RNA-seq fastq file cryptic.exon.q1.fq.gz. There is exactly one highly expressed coding gene that has a cryptic exon in it formed by two novel junctions. Report the HGNC gene symbol (uppercase) for that gene.	True	False	cryptic.exon.q1.fq.gz
read-paper-download-file-parse-q1	SN	Epigenomics	Retrieval	API/Web Fetching	Take a look at the pdf here: https://www.biorxiv.org/content/10.1101/2023.10.04.560808v2.full.pdf, can you find the exact number of peaks in the COC/L1 cluster? Follow any external links in the paper if additional data is required to answer this question. Respond with only the number.	True	False	
huggingface-entropy-q1	SN	Machine Learning	Tooling	API/Web Fetching, Coding, Reasoning, ML Frameworks, Tooling	Run the DNA language model here: https://huggingface.co/kuleshov-group/caduceus-ph_seqlen-131k_d_model-256_n_layer-16 on the 1000 bp long DNA sequence at hg38 chr12:7792299-7793299. Specifically, mask each base one at a time, keeping all others unmasked, and compute the per position base 2 entropy of the predictions. Return the substring corresponding to the longest run with <0.5 entropy.	True	True	
ml-model-track-overlap-q1	GE; SN	Epigenomics	Retrieval	API/Web Fetching, Reasoning, Data Wrangling	Borzoi (Linder et al., doi:10.1038/s41588-024-02053-6) and Sei (Chen et al., doi:10.1038/s41588-022-01102-2) are both DNA sequence models trained to predict genomic assay outputs. Out of the Sei tracks that are linked to a specific Cistrome ID, how many tracks share provenance with any of the tracks in Borzoi? Round your answer to the nearest 100.	True	False	
compute-gc-content-interval-q1	AL	Genomics	Routine Analysis	API/Web Fetching, Coding	"Using the GRCh38.p13 human reference genome, retrieve the reference DNA sequence for chromosome 1 from positions 1,000,000 to 1,000,100 (1-based, inclusive) on the '+' strand, and calculate: (1) gc_percent (rounded to 2 decimals), (2) length, (3) n_count (the number of Ns in the sequence), and (4) sequence_md5 (MD5 of the uppercase interval sequence). Return the results as a comma-separated string in the format: gc_percent,length,n_count,sequence_md5. For example: ""31.86,10,50,v24a827t740a77764d0d8e35ba56f612""  "	True	False	
reverse-search-gwas-q1	JR	Population Genetics	Metadata Recovery	API/Web Fetching, Reasoning, Data Wrangling	Identify the PubMed ID of the study from which this summary statistics in reverse.search.gwas.q1.tsv.gz are derived. Print only the PMID, e.g. 31510655. 	True	False	reverse.search.gwas.q1.tsv.gz
pathogenic-variant-lookup-q1	SN	Genomics	Retrieval	API/Web Fetching	Using the human SHH MANE Select transcript on hg38, consider the coding sequence within exon 1. Within this interval, identify all OMIM allelic variants with phenotypes that map to single-nucleotide missense substitutions in SHH. Retrieve the AlphaMissense pathogenicity scores for those amino-acid substitutions. Return the single variant with the highest AlphaMissense score, in chr:pos (1-based) format.	True	False	
identify-donor-q1	SN	Population Genetics	Metadata Recovery	API/Web Fetching, Reasoning, Bioinformatics Tools	The pair end fastqs (identify.donor.R1.fq.gz, identify.donor.R2.fq.gz) correspond to reads from one of the 1000G donors (2504 high coverage set) from a 5Mb region of the genome. Identify the donor and report the 1000G sample ID, e.g. HG03884	True	False	identify.donor.R1.fq.gz, identify.donor.R2.fq.gz
contaminated-rna-q3	SN	Transcriptomics	Synthetic/Augmented Data	Bioinformatics Tools, Reasoning	"You are given a single-end RNA-seq FASTQ file (contaminated.rna.q3.fq.gz). The sample is expected to be human, but it may contain reads from another organism. Determine the genus of the most likely non-human organism present, if any. Report your answer as the exact scientific genus name in all lowercase letters (for example, mus), else respond with ""none""."	True	False	contaminated.rna.q3.fq.gz
hic-differential-loop-q1	SN	Epigenomics	Retrieval	API/Web Fetching, Visual Reasoning, Data Wrangling	Consider the MicroC data for H1 and HFF cells from the following paper: https://doi.org/10.1016/j.molcel.2020.03.003. In the sub-compartment containing the NANOG gene (chr12:7629950-7809597), there is a differential loop between the two samples. Report the position of the loop (on chr12) in the following format start;end, with start<end rounded to the nearest 20000 and no commas.	True	False	
encode-atac-pipeline-q1	SN	Epigenomics	Tooling	Tooling, Data Wrangling	encode.atac.pipeline.q1.R1.fq.gz and encode.atac.pipeline.q1.R2.fq.gz are paired-end ATAC-seq reads from a human sample. Process them through the ENCODE ATAC-seq pipeline v2.2.3 (https://github.com/ENCODE-DCC/atac-seq-pipeline/tree/v2.2.3). Keep the input json similar to https://github.com/ENCODE-DCC/atac-seq-pipeline/blob/v2.2.3/example_input_json/ENCSR356KRQ_subsampled.json, but remove the atac.enable_xcor line. After the pipeline completes, report the reproducibility IDR N_opt number from the qc.json file.	True	False	encode.atac.pipeline.q1.R1.fq.gz, encode.atac.pipeline.q1.R2.fq.gz
pooled-infer-donors-q1	SN	Single-cell	Metadata Recovery	Bioinformatics Tools, Coding, Reasoning	pooled.infer.donors.q1.bam is an aligned scRNA-seq BAM from a pooled human sample. The file includes cell barcode tags. Determine the number of distinct donors contributing cells to the pool.	False	False	pooled.infer.donors.q1.bam
overexpress-tf-q1	SN	Epigenomics	Metadata Recovery	Bioinformatics Tools, Reasoning	We perturbed a primary cell culture with a cocktail of transcription factors (TFs). ATAC-seq is performed on the initial sample and 48 hours after perturbation. overexpress.tf.q1.ref.bed.gz and overexpress.tf.q1.perturb.bed.gz contain the filtered aligned fragment files (hg38) corresponding to the initial and perturbed samples, respectively. Exactly one of the TFs in the following list is part of the cocktail: FOXA1, ASCL1, TFAP2A, RUNX1, KLF4, PAX7, TCF7, REST, SPI1, GATA3. Identify which one.	True	False	overexpress.tf.q1.ref.bed.gz, overexpress.tf.q1.perturb.bed.gz
conservation-lookup-q1	SN	Genomics	Retrieval	API/Web Fetching, Bioinformatics Tools	Using the human SHH MANE Select transcript, take the cDNA sequence from the annotated start codon through the end of exon 1. For each of the following species: Pan troglodytes, Macaca mulatta, Pan paniscus, Indri indri, Semnopithecus johnii, Ailuropoda melanoleuca, Delphinapterus leucas, obtain the orthologous cDNA segment corresponding to the same region (prefer a one-to-one ortholog; if multiple transcripts exist, use the canonical/longest protein-coding transcript). Compute the Levenshtein edit distance to the human sequence. Return results as a comma-separated list (no spaces) in the listed species order.	True	False	
splice-pred-q1	CD	Machine Learning	Tooling	API/Web Fetching, Reasoning, Coding, ML Frameworks, Tooling	Extract the human genomic DNA sequence from hg38 at chr12:120,196,699-120,201,111. This locus is on the minus strand. Run OpenSpliceAI (v0.0.5) to predict with the OSAIMANE-10000nt models, averaging predictions across all 5 checkpoints. Call donor and acceptor splice sites with score ≥ 0.9. Reconstruct exons on the gene strand by pairing each predicted acceptor with the next predicted donor in transcript order, and count the terminal exons using the interval boundaries as transcript boundaries. Report the total number of predicted exons.	True	False	
borzoi-rnaseq-q1	AL	Machine Learning	Tooling	ML Frameworks, Coding, Reasoning, API/Web Fetching, Tooling	Use the Borzoi model (replicate 0) to predict the total RNA-seq coverage on the forward strand for the experiment ENCFF281BWX, over the genomic interval chr1:70157360-70353968 in the hg38 genome. Return the total predicted RNA-seq coverage over the specified interval, which means reversing any transformations that were applied to RNA-seq coverage before training the Borzoi model. The Borzoi paper is saved as borzoi.rnaseq.q1.pdf. Round the answer to the nearest 10.	True	True	borzoi.rnaseq.q1.pdf
calculate-average-gene-expression-q1	GE	Single-cell	Routine Analysis	Coding, Data Wrangling	Using the single-cell dataset in AnnData format located at pbmc3k.h5ad, determine the average log-normalized expression for the gene S100B in all cells belonging to the group labeled 'B cells' in the 'louvain' metadata column. Use adata.X for already log-normalized expression. Use two decimal places in the answer.	False	False	pbmc3k.h5ad
covid-patient-q1	SN	Single-cell	Metadata Recovery	Coding, Reasoning, Data Wrangling	"covid.patients.q1.h5ad contains PBMC scRNA-seq data from 33 donors, who are a mix of healthy and COVID patients. However, the patient metadata is missing. Identify which donors are healthy and which have COVID based on the gene expression data. Provide a single string containing comma-separated donor IDs for the healthy patients (numerically sorted), e.g.""1,2,5""."	False	False	covid.patients.q1.h5ad
saluki-setup-optimize-q1	SN	Machine Learning	Tooling	API/Web Fetching, Coding, Reasoning, ML Frameworks, Data Wrangling, Tooling	Set up the Saluki model detailed in https://doi.org/10.1186/s13059-022-02811-x and use it to optimize the 3' UTR of the mRNA sequence GCCGCCACCATGGTGAGCAAGGGCGAGTAGTGTACATAATAAGGACT. Specifically, perform 3 rounds of directed evolution, trying every possible substitution in the 3' UTR and choosing the best after each round. Always use the average of predictions across all folds and use only the human output. Make sure to use GPUs if available. Report the full sequence of the optimized mRNA.	True	True	
identify-related-q1	JR	Population Genetics	Metadata Recovery	Bioinformatics Tools, Reasoning, Data Wrangling	You are given identify.related.q1.tfam and identify.related.q1.tped.gz files of genotypes. I need to know if there are any 1st-degree relatives. Print a comma separated, sorted list of all individuals with a 1st-degree or closer relative in the dataset (e.g. SAMPLE_001,SAMPLE_002). If no such individuals exist, print None.	True	False	identify.related.q1.tfam,identify.related.q1.tped.gz
ep-interactions-q1	LG	Epigenomics	Synthetic/Augmented Data	Coding, Reasoning, Data Wrangling	You are given two complementary datasets describing eight candidate distal regulatory element–promoter interactions (EP1–EP8): (1) a Hi-C–like chromatin contact dataset measuring 3D proximity between each element–promoter pairs (ep.interactions.q1.hic.csv) and (2) a CRISPR perturbation dataset measuring the effect of element disruption on promoter expression (ep.interactions.q1.expr.csv). Which E–P pair is least consistent with being a true causal regulatory element–promoter interaction when integrating both datasets? Choose exactly one: A) EP1 B) EP2 C) EP3 D) EP4 E) EP5 F) EP6 G) EP7. Reply with a single letter (A-G).	False	False	ep.interactions.q1.hic.csv,ep.interactions.q1.expr.csv
sample-swap-rna-q1	SN	Single-cell	Metadata Recovery	Coding, Reasoning, Data Wrangling	"I have a scRNA-seq pseudobulk lying around from amphioxus tissue (sample.swap.rna.q1.tsv.gz). I'm not sure, but I suspect there is a sample swap. Can you check if that is the case? If there isn't, respond ""None"". Else respond with the names of the two cell types that have been swapped in case-sensitive lexicographic order, e.g. ""endoderm,epidermis""."	True	False	sample.swap.rna.q1.tsv.gz
gene-fusion-q2	SN	Transcriptomics	Synthetic/Augmented Data	Coding, Reasoning, Bioinformatics Tools	You are given a bulk RNA sequencing FASTQ file (gene.fusion.q2.fq.gz) from human. The data contains a synthetic gene that is a fusion of multiple genes. Your task is to identify the genes whose exons make up the fusion gene. Report the answer as the names of the genes joined by a hyphen, in 5' to 3' order, for each exon, written in all uppercase letters, HGNC symbols. For example: TCF21-COL1A1-FN1	True	False	gene.fusion.q2.fq.gz
retina-score-snps-q1	SN	Machine Learning	Tooling	API/Web Fetching, Coding, Reasoning, ML Frameworks, Tooling, Data Wrangling	https://zenodo.org/records/6330053 contains TensorFlow 2 models that are used for scoring the impact of SNPs on ATAC-seq in various cells types, as illustrated in the ScoreSNPs.ipynb notebook in https://zenodo.org/records/6796067. retina.score.snps.q1.tsv contains 500 SNPs (hg19 coordinates), of which half are known to be caQTLs. I would like to score the SNPs following the code in ScoreSNPs.ipynb, using the models corresponding to Rod cell type. After scoring the SNPs, report the AUPRC against the labels given in retina.score.snps.q1.tsv when using the absolute value of Rod_fold_avg_lfc as a predictor. Report answer by rounding down to two decimal places in the format: 0.80. 	True	True	retina.score.snps.q1.tsv
atac-tn5-shift-q1	SN	Epigenomics	Metadata Recovery	Coding, Reasoning	"I got a scATAC-seq fragment file (unknown.shift.frag.bed.gz) from a colleague who aligned it to the hg38 genome. However, they applied a non-standard shift to the reads instead of the typical +4/-5. Can you help figure out what it is? Report answer in the format ""3;-3"" (corresponding to values for 5' and 3' ends)."	True	False	unknown.shift.frag.bed.gz
finding-geo-q1	SN	Single-cell	Metadata Recovery	API/Web Fetching, Reasoning, Bioinformatics Tools, Data Wrangling	finding.geo.q1.h5ad contains a scRNA-seq dataset that is derived from a Supplementary file on GEO, and processed to filter out barcodes with low counts. Find the GSE ID of the corresponding record. Return the GSE ID at the SuperSeries level, e.g. GSE242424.	True	False	finding.geo.q1.h5ad
deg-simple-q1	SN	Transcriptomics	Routine Analysis	Bioinformatics Tools	I have bulk RNA-seq fastq files from 2 human samples (deg.simple.q1.sampleA.fq.gz, deg.simple.q1.sampleB.fq.gz). There is exactly one gene that is strongly differentially expressed between the two samples. Report the HGNC gene symbol (uppercase) for that gene.	True	False	deg.simple.q1.sampleA.fq.gz, deg.simple.q1.sampleB.fq.gz
bigwig-density-q1	SN	Epigenomics	Routine Analysis	Coding, Data Wrangling	From the given ENCFF822FDB.bigWig file corresponding to an ENCODE DNase-seq experiment in mouse brain (mm10), find the 1Mbp interval with the 3rd highest total signal intensity. Consider only those intervals that start at multiples of 1Mbp, and ignore intervals at chromosome ends that are smaller than 1Mbp. Consider only chromosomes 1-19. Report as 0-based coordinates in chr:start-end format (no commas).	False	False	ENCFF822FDB.bigWig
gtf-5-utr-median-len-q1	SN	Transcriptomics	Routine Analysis	Coding, Data Wrangling	"From the given GTF MANE.GRCh38.v1.3.refseq_genomic.gtf.gz, report the median 5' UTR, CDS, and 3' UTR lengths (use numpy median function, rounded down to nearest integer). Only consider MANE Select transcripts and those on standard chromosomes. Consider stop codon as part of CDS. Return a semicolon separated string with no space, e.g. ""45;551;23""."	False	False	MANE.GRCh38.v1.3.refseq_genomic.gtf.gz
contaminated-rna-q2	SN	Transcriptomics	Synthetic/Augmented Data	Bioinformatics Tools, Reasoning	"You are given a single end RNA-seq fastq file (contaminated.rna.q2.fq.gz). This file contains mostly human reads and a small fraction of contaminant reads. Identify the contaminant species present. Report the answer as the exact scientific name of the species in all lowercase letters with a single space separating genus and species, for example ""mus musculus""."	True	False	contaminated.rna.q2.fq.gz
sample-swap-rna-q2	SN	Single-cell	Metadata Recovery	Coding, Reasoning, Data Wrangling	"I have a scRNA-seq pseudobulk lying around from wheat (sample.swap.rna.q2.tsv.gz). I'm not sure, but I suspect there is a sample swap. Can you check if that is the case? If there isn't, respond ""None"". Else respond with the names of the two cell types that have been swapped in case-sensitive lexicographic order, e.g. ""cortex,endodermis""."	True	False	sample.swap.rna.q2.tsv.gz
multiome-match-atac-rna-q1	SN	Epigenomics	Metadata Recovery	Coding, Reasoning	You are given two gzipped TSVs. Rows are features and columns are 8 pseudo-bulk cell populations (same 8 in both files). multiome.match.atac.rna.q1.rna.tsv.gz: RNA TPM (genes × populations). multiome.match.atac.rna.q1.atac.tsv.gz: ATAC 10kb-bin counts normalized to 1e6 (bins × populations). The ATAC columns have been permuted, but RNA columns are in the correct order. For each RNA column i (0-based), output the 0-based index of the matching ATAC column. Respond with a single semicolon-separated string with no spaces, length 8, e.g. 7;6;5;4;3;2;1;0.	True	False	multiome.match.atac.rna.q1.rna.tsv.gz, multiome.match.atac.rna.q1.atac.tsv.gz
spatial-sim-q2	BO	Spatial	Synthetic/Augmented Data	Coding, Reasoning, Visual Reasoning, Data Wrangling	"You are given a set of single cell transcriptomic data and Visium spatial transcriptomic data (spatial.sim.tar.gz). The single cell counts matrix is found at spatial_q_sc_counts.csv, and accompanying cell type metadata is found at spatial_q_sc_metadata.csv. Spatial count data is found at spatial_q_matrix.mtx.gz, gene counts are found at spatial_q_features.tsv.gz, and are found at spot barcodes spatial_q_barcodes.tsv.gz. Finally scale factors are found at spatial_q_scalefactors_json.json, high and low resolution tissue images are found at spatial_q_tissue_hires_image.png and patial_q_tissue_hires_image.png respectively, and tissue positions are found at spatial_q_tissue_positions.csv. The spot-based data is comprised entirely of cell types found in the single cell data. Can you tell me what cell type or cell types, if any, are biased towards being in closer spatial proximity to spots containing Tumor_Core? If none, please return ""None"". Please list these separated by commas in alphabetical order. Expected answer format: Endothelial,Macrophage."	True	False	spatial.sim.tar.gz
reverse-encode-q1	SN	Epigenomics	Metadata Recovery	API/Web Fetching, Reasoning, Coding	For an ENCODE DNase-seq experiment, I started from the filtered BAM produced by the ENCODE4 v3.0.0-alpha.2 (GRCh38/hg38) pipeline. If the experiment had multiple replicates, I pooled all replicate BAMs by concatenating reads (i.e., merged at the read level) before downstream processing. I then applied an additional mapping-quality filter MAPQ ≥ 30, converted alignments to BED using bedtools bamToBed, and computed read counts in fixed 10 kb hg38 genomic bins. I then normalized the counts to sum to 1e6. The resulting binned track for one experiment is reverse.encode.q1.tsv.gz, but I lost the ENCODE experiment accession. Identify the originating ENCODE experiment accession (format ENCSR…) from which this file was derived.	True	False	reverse.encode.q1.tsv.gz
compute-hvg-jaccard-q1	GE	Single-cell	Routine Analysis	Bioinformatics Tools, Data Wrangling	"Using scanpy and the two AnnData H5AD files below, compute the Jaccard index (similarity) between their HVG. First subset them to common genes using the intersection of all gene names. Use exact string values from adata.var_names to resolve genes. Use sc.pp.highly_variable_genes with seurat flavor for HVG identification and default parameters. A gene is considered HVG if var['highly_variable'] string-casts exactly to any of the following (deduplicate this list as needed in order): [""True"", ""True"", ""1"", ""TRUE""]. Do not apply any var-level filter beyond excluding rows with missing gene_symbols. Return NaN if thresholds are not met.  The datasets are: pbmc3k.h5ad and 10x_pbmc68k_reduced.h5ad. Round the answer to two decimal places."	False	False	pbmc3k.h5ad,10x_pbmc68k_reduced.h5ad
deleterious-mutation-q1	SN	Genomics	Routine Analysis	Reasoning, Bioinformatics Tools, Data Wrangling	In the paired FASTQs deleterious.mutation.q1.R1.fq.gz and deleterious.mutation.q1.R2.fq.gz (exome 2×150 bp, reads from human chr9 only), there is one gene that harbors a high-confidence homozygous nonsense SNV for a gene that is highly LoF-intolerant. Report the HGNC gene symbol (uppercase) for that gene.	True	False	deleterious.mutation.q1.R1.fq.gz, deleterious.mutation.q1.R2.fq.gz
genome-assembly-contiguity-q1	SN	Genomics	Routine Analysis	Coding	In the genome reference file GCF_000001215.4_Release_6_plus_ISO1_MT_genomic.fna provided, report the N50 (integer, no commas).	False	False	GCF_000001215.4_Release_6_plus_ISO1_MT_genomic.fna
1000G-retrieve-genotype-q1	SN	Population Genetics	Retrieval	API/Web Fetching, Data Wrangling	At hg38 chr10:110918899 (1-indexed), find the genotypes of the following individuals from the latest 1000G project data: 'HG01248', 'NA19204', 'NA18614', 'NA21123', 'NA19171', 'HG02303', 'HG01274', 'HG03134', 'NA18639', 'HG01383'. Report the answer as comma separated string of genotypes: e.g. 0/0,0/1,1/1,...,0/1	True	False	
annotate-variant-regulatory-overlap-q1	GE	Epigenomics	Retrieval	API/Web Fetching	"Determine the regulatory element that overlap the given variant’s reference span for this specific variant and regulatory  resource, without liftover and reporting 1-based inclusive coordinates. Variant: GRCh38, contig chr19, position 44907187, ref allele G, alt allele A. Regulatory source: ENCODE cCRE Registry, release v4. Return the class of the regulatory element overlapping the variant and the CRE accession (e.g. EH38EXXXXX) as a comma-separated list. Expected output format: ""class,accession""."	True	False	
extract-rna-secondary-structure-q1	GE	Transcriptomics	Routine Analysis	API/Web Fetching	Using the ViennaRNA package, determine the minimum free energy secondary structure for the human 5S ribosomal RNA (RNAcentral accession URS0000668495). Output must use dot-bracket notation. After the structure also output the free energy up to two decimal places in kcal/mol units. Use comma (no spaces) to separate the structure and the free energy.	True	False	
protein-shape-q1	SN	Structure	Synthetic/Augmented Data	Coding, Visual Reasoning	Consider the PDB protein in the file protein.shape.q1.pdb. Which of the following uppercase letters does it resemble most closely: B, D, F, H, J, L, N, P, R, T, V, X, Z? Consider all possible projections and pick the best fit.	False	False	protein.shape.q1.pdb
deg-simple-q2	SN	Transcriptomics	Routine Analysis	Coding, Reasoning, Bioinformatics Tools	I have bulk RNA-seq fastq files from 2 human samples (deg.simple.q2.sampleA.fq.gz, deg.simple.q2.sampleB.fq.gz). There is exactly one gene that has differentially expressed isoforms in the 2 samples. Report the HGNC gene symbol (uppercase) for that gene.	True	False	deg.simple.q2.sampleA.fq.gz, deg.simple.q2.sampleB.fq.gz
match-genotypes-q1	JR	Population Genetics	Metadata Recovery	Bioinformatics Tools, Reasoning, Data Wrangling	match.genotypes.q1.tar.gz contains plink genotype files in hg38 for 4 individuals of European ancestry (match.genotypes.1.1.*) and a shuffled metadata table (match.genotypes.1.2.csv) for the same 4 individuals. Please provide the most likely mapping from the IIDs in the plink files to the sample IDs in the metadata file. Format your answer as follows: “SAMPLE001,MIX1;SAMPLE002,MIX2;SAMPLE003,MIX3;SAMPLE004,MIX4”. IIDs should be in lexicographic order. You are also given genotypes for an additional set of European ancestry individuals (match.genotypes.1.3.*), which could be helpful. The individuals contained in match.genotypes.1.1.* are non-overlapping with match.genotypes.1.3.*	False	False	match.genotypes.q1.tar.gz
