dataset_alias	source_type	source	notes
chowell_train_response_local	local_path	dataset/experiment_1/Chowell_train_Response.tsv	local copy of the Chowell training cohort with Response labels
chowell_test_response_local	local_path	dataset/experiment_1/Chowell_test_Response.tsv	local copy of the Chowell held-out cohort with Response labels
chowell_test_no_response_remote	url	https://zenodo.org/records/13885908/files/Chowell_test_No_Response.tsv	feature-only table for the Chowell test cohort from the workflow-builder experiment
msk1_response_remote	url	https://zenodo.org/records/13885908/files/MSK1_Response.tsv	external validation cohort with response labels
msk1_no_response_remote	url	https://zenodo.org/records/13885908/files/MSK1_No_Response.tsv	external validation cohort without labels
